<?xml version='1.0' encoding='UTF-8'?>
<!DOCTYPE dataset SYSTEM "../database.dtd">
<dataset>
	<NUMBER_VALUE ID="1" INT_VALUE="0" VERSION="0" />
	<NUMBER_VALUE ID="2" INT_VALUE="1" VERSION="0" />
	<NUMBER_VALUE ID="3" INT_VALUE="2" VERSION="0" />
	<NUMBER_VALUE ID="4" INT_VALUE="3" VERSION="0" />
	<NUMBER_VALUE ID="5" INT_VALUE="5" VERSION="0" />
	<NUMBER_VALUE ID="6" INT_VALUE="6" VERSION="0" />
	<NUMBER_VALUE ID="7" INT_VALUE="10" VERSION="0" />
	<NUMBER_VALUE ID="8" VERSION="0" />
</dataset>